### ISSUE TITLE
advertise single AFI/SAFI pair for a BGP session

### ISSUE THREAD

**Issue by zolug** [Nordix/Meridio#370]
**Describe the bug**
Currently in Meridio BGP sessions are associated either with an IPv4 Gateway or with an IPv6 Gateway.
However, in our case a BGP session advertises multi-protocol extension capability for both IPv4 unicast and IPv6 unicast, which might cause "capability mismatch" problems when peering with certain routers (probably also depends on the router side configuration).

To eliminate such problems in the future, it would be beneficial to only advertise the "right" AFI/SAFI pair, so either IPv4/unicast or IPv6 unicast depending on the Gateway config (address family type).

The root cause of the problem seems to be how the BIRD configuration is assembled by the FE:
A common BGP template is used that contains both an IPv4 and an IPv6 [channel](https://bird.network.cz/?get_doc&v=20&f=bird-2.html#ss2.3) with settings to block import/export of routes. When creating a BGP session for a Gateway the template config is inherited and the respective channel is updated (with proper export/import filters for example). But the _other_ channel will be also included in the final BGP session config causing the BGP to advertise related AFI/SAFI pair as well.

Using separate BGP templates (containing a single channel) for IPv4 and IPv6 BGP sessions would solve the problem.

**To Reproduce**
1. Deploy a Trench with a full config where the Gateways are configured to use BGP.
2. Inspect (tcpdump+wireshark) the BGP OPEN msg sent by a Frontend checking the capability options included.

**Expected behavior**
In case of IPv4 Gateway the multiprotocol extension capability should advertise IPv4 unicast, while for IPv6 Gateway IPv6 unicast should be announced.

**Context**
 - Network Service Mesh: v1.7.1
 - Meridio: 1.0.0

**Logs**
BGP OPEN msg from a FE configured with IPv4 Gateway (contains both ipv4 unicast and ipv6 unicast)
```
Frame 503: 119 bytes on wire (952 bits), 119 bytes captured (952 bits)
Ethernet II, Src: 02:fe:33:a8:23:27 (02:fe:33:a8:23:27), Dst: 02:42:ac:12:00:06 (02:42:ac:12:00:06)
Internet Protocol Version 4, Src: 169.254.100.1, Dst: 169.254.100.150
Transmission Control Protocol, Src Port: 35629, Dst Port: 10179, Seq: 3069448934, Ack: 961332669, Len: 53
Border Gateway Protocol - OPEN Message
    Marker: ffffffffffffffffffffffffffffffff
    Length: 53
    Type: OPEN Message (1)
    Version: 4
    My AS: 8103
    Hold Time: 3
    BGP Identifier: 10.244.2.11
    Optional Parameters Length: 24
    Optional Parameters
        Optional Parameter: Capability
            Parameter Type: Capability (2)
            Parameter Length: 22
            Capability: Multiprotocol extensions capability
                Type: Multiprotocol extensions capability (1)
                Length: 4
                AFI: IPv4 (1)
                Reserved: 00
                SAFI: Unicast (1)
            Capability: Multiprotocol extensions capability
                Type: Multiprotocol extensions capability (1)
                Length: 4
                AFI: IPv6 (2)
                Reserved: 00
                SAFI: Unicast (1)
            Capability: Route refresh capability
            Capability: Support for 4-octet AS number capability
            Capability: Enhanced route refresh capability
```

BGP OPEN msg for an IPv4 Gateway with the proposed change:
```
Frame 581: 113 bytes on wire (904 bits), 113 bytes captured (904 bits)
Ethernet II, Src: 02:fe:1f:ab:1b:93 (02:fe:1f:ab:1b:93), Dst: 02:42:ac:12:00:06 (02:42:ac:12:00:06)
Internet Protocol Version 4, Src: 169.254.100.1, Dst: 169.254.100.150
Transmission Control Protocol, Src Port: 45775, Dst Port: 10179, Seq: 3221282450, Ack: 1519374955, Len: 47
Border Gateway Protocol - OPEN Message
    Marker: ffffffffffffffffffffffffffffffff
    Length: 47
    Type: OPEN Message (1)
    Version: 4
    My AS: 8103
    Hold Time: 3
    BGP Identifier: 10.244.1.19
    Optional Parameters Length: 18
    Optional Parameters
        Optional Parameter: Capability
            Parameter Type: Capability (2)
            Parameter Length: 16
            Capability: Multiprotocol extensions capability
                Type: Multiprotocol extensions capability (1)
                Length: 4
                AFI: IPv4 (1)
                Reserved: 00
                SAFI: Unicast (1)
            Capability: Route refresh capability
            Capability: Support for 4-octet AS number capability
            Capability: Enhanced route refresh capability
```
